,Title,Published_date,Views,Likes,Favorite,Comments,Month
265,TSP: Sharman Joshi leaked footage || Khatron Ke Khiladi Audition || The Jizzy- Veerji show,2015-11-26,258681,4841,0,120,Nov
266,TSP : Anonymous - Operation Bollywood Mediocrity #OpBollywood,2015-11-22,95004,1496,0,85,Nov
267,TSP || Fatafat Ft. Ayushmann Khurrana,2015-11-20,87927,1236,0,33,Nov
268,TSP || Bloopers || Pyaar Ka Punchnama Speech || Office Version,2015-11-12,29067,240,0,9,Nov
269,TSP || Pyaar Ka Punchnama Speech || Office Version,2015-11-06,896500,25192,0,597,Nov
270,TSP || Neil Nitin Mukesh on 'Game Of Thrones' Casting || Exclusive Interview,2015-11-04,348383,3315,0,91,Nov
271,TSP || Bollywood Cricket Commentary Ep-2 || Sidhu vs Sidhu,2015-10-31,582958,11012,0,424,Oct
272,TSP || The Jizzy - Veerji Show || Compilation,2015-10-11,284733,4673,0,108,Oct
273,TSP || Rahul Gandhi meets Mahatma Gandhi,2015-10-02,2178005,60395,0,3245,Oct
274,TSP || DumbSmash Ep.1 Dheere Dheere Se Meri Zindagi,2015-09-18,1158321,21649,0,483,Sep
275,TSP || iPhone's Glitch || Siri on Periods ||,2015-09-14,510399,16805,0,443,Sep
276,TSP || That Man Begins || A Superhero with Middle Class Powers,2015-08-27,1469997,31721,0,657,Aug
277,TSP || That Man Begins Official Teaser,2015-08-18,65503,876,0,28,Aug
278,TSP || Daaru Pe Charcha Ep. 01 ft. FTII's New Chairman Gaj Ji,2015-07-31,3039357,36505,0,1130,Jul
279,TSP || Bollywood Cricket Commentary -  Shah Rukh Khan vs Kajol | Episode 01,2015-07-16,987729,22632,0,560,Jul
280,TSP || Govinda Vs Bruno Mars - Uptown Funk Mashup,2015-06-23,347013,3234,0,91,Jun
281,TSP || Bhai Hoes react to Bajrangi Bhaijaan Trailer,2015-06-18,110995,1510,0,87,Jun
282,TSP || News-Sance | Maggi - The Untold Story,2015-06-12,467232,9165,0,268,Jun
283,TSP || Lazy Terrorist,2015-06-05,9570526,242941,0,6816,Jun
284,TSP || Save The Bhai,2015-05-14,1836927,26796,0,1521,May
285,TSP || Sunny Wala Song | Paani Wala Dance Parody,2015-05-05,860588,7998,0,223,May
286,TSP's Behind The Scenes || Ep01: Scavengers - The Return of Indian Superheroes,2015-05-02,58700,666,0,13,May
287,TSP || Scavengers - The Return of Indian Superheroes,2015-04-27,3299844,46880,0,1301,Apr
