,Title,Published_date,Views,Likes,Favorite,Comments,Month
0,Bro Code 4 | The Screen Patti,2022-06-22,315446,20889,0,522,Jun
1,Father's Day Celebration In Indian Style  | TSP,2022-06-19,118641,6221,0,21,Jun
2,Rabish Ki Report Deleted Scene | TSP,2022-06-16,134977,7838,0,86,Jun
3,Every govt school boy ever | TSP,2022-06-11,128962,5405,0,51,Jun
4,Laal Singh Chaddha Spoof | The Screen Patti,2022-06-02,2083924,152459,0,8332,Jun
5,Laal Chaddha and Gajju,2022-05-29,132654,5541,0,34,May
6,"TSP's If Superstitions Were Real 3 | Ft. Shivankit Parihar, Saad Bilgrami & Anandeshwar Dwivedi",2022-05-27,881251,48822,0,1107,May
7,"Tsp's Kisse Sarkari Naukari ke | Ft. Anant Singh 'Bhaatu', Anandeshwar Dwivedi & Vaibhav Shukla",2022-05-23,770836,45124,0,1625,May
8,NEIGHBOURS | E03- Andheri Raat Ft.Anandeshwar Dwivedi and Anant Singh 'Bhatu' | TSP Originals,2022-05-12,310919,14986,0,527,May
9,NEIGHBOURS | E02-Parcel Ki Adla Badli Ft.Anandeshwar Dwivedi and Anant Singh 'Bhatu' | TSP Originals,2022-05-06,363450,15847,0,436,May
10,"NEIGHBOURS | E01 - Nayi Padosan | Ft. Ankit Motghare, Prakhar Sharma & Monica Sharma | TSP Originals",2022-04-29,541163,23621,0,579,Apr
11,Neighbours | Official Trailer | Ft. Anandeshwar Dwivedi & Anant Singh Bhaatu | TSP Originals,2022-04-27,115383,4786,0,149,Apr
12,This Scene has a separate fan base 😜,2022-04-20,4474811,144330,0,701,Apr
13,Crush makes you crazy,2022-04-10,124726,4007,0,29,Apr
14,Tsp's kisse Sarkari Aspataal ke | किस्से सरकारी अस्पताल के Ft. Abhinav Anand & Anant Singh 'Bhaatu',2022-04-01,957652,47404,0,1007,Apr
15,TSP'S Kekda Tank India | Shark Tank Spoof,2022-03-24,1219259,59469,0,2021,Mar
16,"Big B Holi Party Ft. Shivankit Parihar, Anandeshwar Dwivedi, Ankit Motghare",2022-03-16,1864101,132889,0,4143,Mar
17,"Elections In Different States | Not ft. Shivankit, Badri & Bade-Chote",2022-03-12,1077724,61328,0,1614,Mar
18,When Ex ki yaad hits you hard 😪,2022-03-06,166160,7571,0,36,Mar
19,"TSP’s Rabish Ki Report | Valentine's Day Special ft. Shivankit Parihar, Badri Chavan, Khushboo Baid",2022-02-13,2830709,197082,0,8175,Feb
20,THE BRO CODE 😎👊,2022-02-11,12982922,1124705,0,890,Feb
21,Engineering is the first step of everything 😌,2022-02-09,1529510,78887,0,202,Feb
22,"When you can't Say no, you face many problems 😪",2022-02-06,1045188,56191,0,335,Feb
23,An honest Funeral 😜,2022-02-04,7392646,353695,0,862,Feb
24,"Nahi bolte hum Rant, Hum Bhadaas bolte hain 🔥",2022-01-31,3161111,173954,0,438,Jan
25,Raja Rabish's Friday plans 🕺🍻,2022-01-28,232664,16061,0,98,Jan
26,When you Date a UPSC Aspirant 😂❤,2022-01-23,7051171,375562,0,998,Jan
27,सावधान इंडिया Spoof 4- ‘खूनी भाभी’ | TSP’s Bade Chote,2022-01-21,3519073,224874,0,7120,Jan
28,Hum Tum's Propose 😍,2022-01-15,9398225,508812,0,1905,Jan
29,Haq se Single 😎,2022-01-09,836543,54600,0,256,Jan
30,"TSP's BAAP BAAP HOTA HAI | Ep 13 : BIKE KI CHORI Ft. Abhinav Anand & Anant Singh ""Bhaatu""",2022-01-04,2367677,143198,0,3018,Jan
31,When you belong to a middle class indian  family 😜,2021-12-29,689672,34969,0,273,Dec
32,Vicky - Kat ki shadi ki boliyaan 🥳,2021-12-17,667593,32746,0,422,Dec
33,"TSP's Behind The Scenes | Ep05 : Vicky & Katrina's Wedding Ft. Shivankit Parihar, Pratish & Abhinav",2021-12-12,5489385,324640,0,14621,Dec
34,"TSP's Crush on your Best Friend's Girlfriend Ft. Badri Chavan, Ambrish Verma & Kangan Nangia",2021-12-10,897504,44338,0,1023,Dec
35,Weekend Party scenes 🍻 GIRLS VS. BOYS,2021-12-05,312262,16427,0,98,Dec
36,"Swapndosh 11 ft. Dhawan, Pandya, Kohli & Shastri",2021-11-17,1112644,66081,0,1300,Nov
37,TSP’s IND VS PAK Special / Inzy Bhai Unboxing ‘Cricket Kit’,2021-10-23,1867461,129540,0,5841,Oct
38,"TSP’s Baap Baap Hota Hai | Ep12 : Politician Beta ft. Abhinav Anand, Anant Singh 'Bhatu'",2021-09-15,2347894,124344,0,2412,Sep
39,TSP's Bade Chote || Gatron Ke Khiladi 2,2021-08-28,4716971,272481,0,6070,Aug
40,"TSP’s Teen Tigaada Kaam Bigaada | E03 Ladki Ka Chakkar ft. Nikhil Vijay, Alam Khan & Vaibhav Shukla",2021-08-11,439405,19044,0,443,Aug
41,"TSP’s Teen Tigaada Kaam Bigaada | E02 Darr Ka Saamna ft. Nikhil Vijay, Alam Khan & Vaibhav Shukla",2021-08-04,567970,22996,0,582,Aug
42,"TSP’s Viral Biryani | Naughty Kundra ft. Anandeshwar Dwivedi, Vaibhav Shukla",2021-07-31,569505,40037,0,914,Jul
43,"Sandeep Bhaiya शादी वाले ft. Sunny Hinduja, Rabish Kumar, Abhinav Anand, Anant Singh ‘Bhaatu’",2021-06-26,2570409,158386,0,6327,Jun
44,"TSP's Ek Din Ka Principal ft. Badri Chavan, Abhinav Anand & Saad Bilgrami",2021-06-12,3323967,190457,0,4160,Jun
45,"TSP’s Teen Tigaada Kaam Bigaada | E01 Live Match ft. Nikhil Vijay, Alam Khan & Vaibhav Shukla",2021-04-09,1094608,41153,0,768,Apr
46,"TSP’s Rabish Ki Report | Ep 15 : IPL Special ft. Shivankit Parihar, Badri Chavan, Abhinav Anand",2021-04-01,3002971,177156,0,13999,Apr
47,"TSP’s Baap Baap Hota Hai | Ep11 : Influencer Beta ft. Abhinav Anand, Anant Singh 'Bhatu'",2021-03-16,1708472,86479,0,2228,Mar
48,"TSP’s Baap Baap Hota Hai | Ep10 : Bete Ka Startup ft. Abhinav Anand, Anant Singh 'Bhatu'",2021-02-24,2390071,121657,0,2576,Feb
49,"TSP’s Baap Baap Hota Hai | Ep09 : Bete Ka Result ft. Abhinav Anand, Anant Singh 'Bhatu'",2021-02-20,2820356,145545,0,3108,Feb
50,TSP's Kangana and Diljit on a Date,2021-02-15,976849,65051,0,4207,Feb
51,"TSP’s Behind The Scenes | Ep04 : Virushka ki Baby Party | Ft. Virat, Anushka & Pandya",2021-01-20,2739744,156576,0,5391,Jan
52,TSP's Baap Baap Hota Hai | Ep08 : Goa Ki Permission,2020-12-22,2233656,135984,0,3013,Dec
53,TSP's Googly Yaad Hai ft. Badri Chavan and Sachin Negi,2020-12-17,705789,41566,0,969,Dec
54,"TSP’s School Diaries | 10th ke baad kya hoga? ft. Pratish, Urvi & Saad",2020-12-10,1989765,110005,0,2926,Dec
55,TSP's If Big B was an ATM ft. Shivankit Parihar & Khushbu Baid,2020-12-02,1270827,71850,0,1885,Dec
56,TSP’s Jab We Met Raavan ft. Gagan Arora & Shivankit,2020-11-07,1658095,69773,0,2526,Nov
57,TSP's Baap Baap Hota Hai | Ep 07 : Naya Kirayedaar ft. Abhinav Anand and Anant Singh 'Bhatu',2020-10-24,2892761,152991,0,2945,Oct
58,"TSP's When You Can’t Say No ft. Shivankit, Shreyasi, Pratish and Deepesh",2020-10-16,1081374,56587,0,1808,Oct
59,TSP's Fun Ki Baat Ft. @Vipul Goyal and Raja Rabish kumar,2020-09-18,809944,38711,0,1433,Sep
60,TSP's Bachelors ka Work From Home Ft. Shivankit & Chote Miyan,2020-09-09,2999681,145774,0,4241,Sep
61,TSP's School Diaries | Online Viva | Teacher's Day Special Ft. Kaushal Sir,2020-09-05,1492619,84701,0,1910,Sep
62,TSP's Behind The Scene: MS DHONI RETIREMENT,2020-08-19,2411820,181155,0,6251,Aug
63,Independence Day LIVE STREAM with RAJA RABISH KUMAR,2020-08-15,607331,33743,0,1404,Aug
64,TSP's Rabish ki report Unlock 2.0 | Ep 14 : लौंडों का दर्द,2020-08-08,1906810,109527,0,7885,Aug
65,TSP's YouTubers On Nepotism,2020-07-30,530778,47022,0,2977,Jul
66,TSP's Bachelors Vs Landlords | A Rant,2020-06-15,1796533,36888,0,1020,Jun
67,TSP's Lockdown In Different States,2020-06-09,1464277,80478,0,5190,Jun
68,TSP's Googly | What To Watch Next?,2020-06-01,855942,60794,0,2120,Jun
69,TSP's Rabish Ki Report | Ep 13 : लौंडों का Lockdown,2020-05-27,3717125,219016,0,9553,May
70,Ghar Baithe Lakhpati | KBC Spoof | TSP's Bade Chote,2020-05-15,3114312,166999,0,6162,May
71,TSP's Baap Baap Hota Hai | Ep06 : Baap aur Corona,2020-05-11,2515110,125256,0,2360,May
72,TSP's Baba Calling Bhai | Daaru Hai Kya?,2020-05-06,318640,17000,0,817,May
73,TSP’s Lockdown Wala Match,2020-05-02,840528,32317,0,1545,May
74,TSP’s YouTubers In Lockdown,2020-04-24,690820,40490,0,2183,Apr
75,"TSP’s Celebrities During Lockdown ft. Salman, Virat, Nawaz, Karan & Akshay",2020-04-14,1506022,74124,0,3435,Apr
76,TSP’s Hum Tum | Ep06 : Road Trip,2020-03-13,4499579,158185,0,3079,Mar
77,TSP's Nawab Sahab | खोज का बोझ,2020-03-04,2845660,121393,0,2734,Mar
78,E06: My Pregnant Girlfriend | TSP's Awkward Conversations With Girlfriend | TSP Originals,2020-02-14,6625319,233164,0,10172,Feb
79,"Yaar Di Doli | Wedding Anthem 2020 | Featuring Burrah, Shreya Mehta, Ankur, Naser, ShowKidd",2020-02-10,203679,7056,0,225,Feb
80,E05: Moving In ft. Parents | TSP's Awkward Conversations With Girlfriend | TSP Originals,2020-02-07,5804068,193704,0,7075,Feb
81,TSP's Bhartiya YouTube Sena,2020-02-04,2176893,79864,0,5026,Feb
82,E04: Bumping Into My Ex | Awkward Conversations With Girlfriend | TSP Originals,2020-01-31,6591454,208356,0,8134,Jan
83,TSP’s Rabish Ki Report | Ep 12: रबिश पहुंचे शादी में,2020-01-28,5602268,221662,0,12711,Jan
84,Awkward Conversations With Girlfriend | E03: Password | TSP Originals,2020-01-24,6946637,198709,0,3466,Jan
85,Awkward Conversations With Girlfriend | E02: My Girlfriend’s Hot Friend | TSP Originals,2020-01-17,5800527,173125,0,4758,Jan
86,TSP's नानी की कहानी | भंड लकड़हारे,2020-01-14,1464996,74450,0,3721,Jan
87,Awkward Conversations With Girlfriend | E01: Porn | TSP Originals,2020-01-10,8076586,314642,0,8730,Jan
88,Awkward Conversations With Girlfriend Trailer | TSP Originals,2020-01-06,1319059,55946,0,1530,Jan
89,TSP’s Rabish Ki Report | Ep 12 : Rabish Ki Rail Yatra,2019-12-28,9155485,343154,0,13912,Dec
90,TSP's Rabish Ki Report | Ep 11: Boys Hostel - Hostel Daze Special,2019-12-23,5320276,214741,0,7996,Dec
91,"Big Boss का पर्दाफाश ft. Badri Chavan, Jizzy & Parul Gulati",2019-12-14,1982548,68928,0,2153,Dec
92,TSP's School Diaries | Class में नई लड़की | Children's Day Special,2019-11-14,8334320,316595,0,11808,Nov
93,TSP's A Day Before Resignation,2019-10-30,1930029,65569,0,1734,Oct
94,Ghar Ka Aakhri Din - TSP Singles,2019-10-25,2087056,76834,0,3242,Oct
95,Hostel Games Part 2 | TSP's Bade Chote | Sacred Games Spoof,2019-10-21,3256342,92369,0,4368,Oct
96,Hostel Games Part 1 | TSP's Bade Chote | Sacred Games Spoof,2019-10-12,3823153,132982,0,4974,Oct
97,TSP's Hostel Games Trailer | Sacred Games Spoof,2019-10-05,1344189,65183,0,2042,Oct
98,TSP's Baap Baap Hota Hai | Ep05 : माता का जगराता - Navratri Special,2019-09-30,4036170,158795,0,5467,Sep
99,TSP’s Frank Office Trips | Ft. Naveen Kasturia,2019-09-20,2345760,91940,0,3995,Sep
100,TSP’s Baap Baap Hota Hai | Ep04 : Night Out Ki Permission,2019-09-18,4855656,195473,0,4379,Sep
101,TSP's Frank Indian Funerals,2019-08-22,6128972,277616,0,12023,Aug
102,सावधान इंडिया Spoof 3 - ‘जानलेवा दोस्ती’ | TSP’s Bade Chote,2019-08-07,5761821,237576,0,8144,Aug
103,Prank with Diljit Dosanjh Gone Wrong | Prime Time With Rabish,2019-07-24,1837926,86844,0,1863,Jul
104,TSP’s Rabish Ki Report | Ep10 : School Ki Parent-Teacher Meeting,2019-07-19,5422980,233281,0,9277,Jul
105,TSP’s Classic Jhands with Jabey Akhtar ft. Sarpraj Ahmed,2019-07-16,1179008,37271,0,2826,Jul
106,Royal Challenge Sports Drink Bold League Season 2 | EP 5 | The Grand Finale with RCB,2019-07-03,2818780,11064,0,270,Jul
107,Royal Challenge Sports Drink Bold League Season 2 | EP 4 | Road To The finals,2019-07-03,2682333,8371,0,138,Jul
108,Royal Challenge Sports Drink Bold League Season 2 | EP 3 | The Inter-State Knockouts,2019-07-03,2023530,6300,0,137,Jul
109,Royal Challenge Sports Drink Bold League Season 2 | EP 2 | The Top Contenders,2019-07-03,3598057,10016,0,229,Jul
110,Royal Challenge Sports Drink Bold League Season 2 | EP 1 | India Plays Gully Cricket,2019-07-03,2396135,15793,0,423,Jul
111,TVF Play | Weekends S01E01 I Watch all episodes on www.tvfplay.com,2019-06-29,7100,231,0,16,Jun
112,TVF Play | Awkward Conversation With Parents S01E01 I Watch all episodes on www.tvfplay.com,2019-06-26,32188,643,0,35,Jun
113,TSP's Baap Baap Hota Hai | Ep03 : Baap Ka Janamdin,2019-06-18,3688453,152962,0,3623,Jun
114,Super 30 Trailer Spoof | Super 36 | TSP's Tribute to Yuvraj,2019-06-14,1958556,110679,0,2752,Jun
115,TSP’s Nawab Sahab aur Shauk,2019-06-12,3619204,146076,0,5671,Jun
116,TSP’s If Month-End Was A Person,2019-05-31,3982478,139402,0,2528,May
117,TSP’s Baap Baap Hota Hai | Ep02 : Baap vs Beta,2019-05-29,3095516,112032,0,3153,May
118,New on TVFPlay | The best of Indian Web Series,2019-05-27,8260,107,0,26,May
119,Next From The House of TVF,2019-05-27,308221,20447,0,1460,May
120,Manchahi Baat With Modi Ji | Prime Time With Rabish,2019-05-22,5924591,284083,0,28339,May
121,The Master Bedroom | TSP's Bhai Bhai,2019-05-18,2038969,70175,0,1350,May
122,TSP’s Papa Actor Banna Chahte Hain,2019-05-15,1413332,33275,0,1201,May
123,TSP's Hum Tum | Ep05 : Is it a break?,2019-05-08,4724939,153126,0,3952,May
124,TSP's Signs That She Will Leave You,2019-05-04,2337144,79778,0,3504,May
125,TSP's Single Launde Anthem | Music Video,2019-04-15,675241,39536,0,1934,Apr
126,Laundo Ka Love Triangle | TSP's Bhai Bhai,2019-04-04,2752388,105945,0,3974,Apr
127,Baal pe Charcha | Primetime with Rabish | Ft. Jeetu and Shweta Tripathi,2019-03-25,2389411,84666,0,3172,Mar
128,TSP's Badri ki Dulhaniya,2019-03-16,4045495,126734,0,3232,Mar
129,Ex Ki Shaadi | TSP's Bhai Bhai,2019-03-11,4147114,137908,0,4775,Mar
130,TSP's Reunion RoadTrip,2019-03-05,3955223,130631,0,5263,Mar
131,TSP’s A Day Before First Date,2019-02-28,2066584,73123,0,2308,Feb
132,TSP's A Date With An Entrepreneur,2019-02-25,4321147,159136,0,4464,Feb
133,TSP's Hum Tum | Ep04 : First Valentine's Date,2019-02-14,5191711,167982,0,4268,Feb
134,TSP's When you Cheat on your phone,2019-02-08,3108148,104233,0,5209,Feb
135,Kahaani Thi | TSP's Hum Tum | Music Video,2019-02-04,2495655,69940,0,2123,Feb
136,TSP's Hum Tum | Ep03 : When you fall in Love,2019-01-28,7672195,286134,0,10080,Jan
137,"Indian Cricket Dressing Room | TSP's Behind the scene | Ft.Kohli, Pandya and KL Rahul",2019-01-19,9303163,309515,0,15826,Jan
138,TSP Googly E02 | Aur Dikhao,2019-01-16,2716217,112422,0,3067,Jan
139,Gully Cricket Tips by Nehra Ji | RCBL Special,2019-01-12,266074,9643,0,450,Jan
140,Asli Tic Toc || Gully Boy Teaser Trailer Spoof,2019-01-09,4154293,203750,0,8775,Jan
141,TSP's Hum Tum| Ep02 : Friendzone se kaise bachein?,2019-01-07,6712545,286345,0,9347,Jan
142,Inzy Bhai Unboxing 'Pubg Crate' | TSP's New Year Special,2019-01-03,3963012,149616,0,9199,Jan
143,Rewind 2018 | Prime Time with Rabish,2018-12-29,1624471,108472,0,4544,Dec
144,Avengers Playing Kabaddi | TSP's Avengers Spoof,2018-12-26,3499226,144063,0,7420,Dec
145,Avengers in Indian Wedding | TSP's Avengers Spoof | 3 Million Special,2018-12-20,7662065,312205,0,15864,Dec
146,BIG B DUBBING MOWGLI GONE WRONG | The Screen Patti,2018-12-13,3339723,122302,0,6326,Dec
147,TSP’s Rabish Ki Report | Ep09: Rabish Chala Gym Part 1,2018-12-08,4775250,157761,0,4895,Dec
148,TSP’s Rabish Ki Report | Ep09 : Rabish Chala Gym Part 2,2018-12-08,5563951,202886,0,5588,Dec
149,Koffee With Karan Spoof ft. Taimur and Ranbir | Bade Chote,2018-12-05,7034873,219834,0,7319,Dec
150,Ab Khel Ke Dikha ft. Virat Kohli | Royal Challenge Sports Drink Bold League | Promo 2,2018-12-03,714157,9086,0,345,Dec
151,"Viral Stars Anthem ft. Ashish Chanchlani, Mukti Mohan and Pranitha Subhash",2018-11-30,1265113,14772,0,948,Nov
152,Ab Khel Ke Dikha ft. Virat Kohli | Royal Challenge Bold League Promo,2018-11-26,1133498,22754,0,942,Nov
153,TSP’s Baap Baap Hota Hai | Ep 01: Ghar Pe Girlfriend,2018-11-24,5319816,196578,0,7469,Nov
154,TSP Googly | Lighter hai kya?,2018-11-20,3260218,98720,0,2674,Nov
155,TSP's Behind The Scenes | Ep03 : Ranveer weds Deepika,2018-11-15,13364447,501790,0,39352,Nov
156,TSP’s College Ka Aakhri Din,2018-11-12,2206551,107517,0,4199,Nov
157,TSP's If Crackers were People,2018-11-07,2586638,113567,0,2651,Nov
158,TSP's Hum Tum | Ep01 : Diwali with Her,2018-11-03,5289414,215448,0,3894,Nov
159,TSP's If Your Boss Behaved like SRK ft. Jayvijay Sachan,2018-11-01,1522891,76128,0,5274,Nov
160,TSP’s When you date a UPSC aspirant ft. Jeetu and Apoorva,2018-10-17,20188107,646333,0,27743,Oct
161,"बधाई हो | Prime Time with Rabish Ft. Ayushmann Khuranna, Sanya Malhotra & Gajraj Rao",2018-10-14,3898784,147877,0,4351,Oct
162,Sacred Games Spoof | Tinder Games Part 2 - “Prem Sambandh” | TSP’s Bade Chote,2018-10-09,6498507,145122,0,6997,Oct
163,Sacred Games Spoof | Tinder Games Part 1 - “Brahmacharya” | TSP’s Bade Chote,2018-10-09,4339938,89203,0,2927,Oct
164,Sacred Games Spoof | Official Trailer | Releasing on 9th October | TSP's Bade Chote,2018-10-03,1868525,56547,0,3033,Oct
165,TSP’s Society Ka जासूस,2018-09-30,1900994,51120,0,2384,Sep
166,TSP's Weekends | Clean Official Trailer | 1st Episode on 28th September,2018-09-25,498099,4074,0,184,Sep
167,TSP's Weekends | Official Trailer | 1st Episode on 28th September,2018-09-21,388990,12619,0,577,Sep
168,Zakir Khan Podcast: feat. Team Yeh Meri Family | Binge watch on TVFPlay,2018-09-11,838714,22886,0,1656,Sep
169,TSP's Rabish Ki Report | Ep08 : LGBTQ का जश्‍न,2018-09-07,3864488,144027,0,9515,Sep
170,दो बिहारी सब पे भारी | Prime Time with Rabish Ft. Manoj Bajpayee,2018-08-31,6868687,311194,0,10754,Aug
171,TSP's Family: 90s vs Now,2018-08-24,1347602,54982,0,1592,Aug
172,TSP’s Serial Spoiler,2018-08-21,1909276,55209,0,3055,Aug
173,KBC Spoof 2 | TSP’s Bade Chote,2018-08-11,7543493,278619,0,11588,Aug
174,TSP's If Superstitions Were Real 2 | 2 Million Special,2018-08-03,4229908,157326,0,5329,Aug
175,TSP's Awkward Conversations | Official Trailer | 1st Episode on 17th,2018-07-14,962420,23994,0,984,Jul
176,TSP’s Rabish Ki Report | Ep07 : Football ka Fever,2018-07-11,3307750,123607,0,9164,Jul
177,TSP’s Rabish Ki Report | E06 : Ladkiyon Ki House Party,2018-07-05,5600841,211287,0,18432,Jul
178,सावधान  इंडिया Spoof 2 - ‘हीरोइन की मौत’ | TSP’s Bade Chote,2018-07-02,9115409,294033,0,11237,Jul
179,TSP's Breakup with Phone,2018-06-25,2877768,112335,0,7846,Jun
180,TSP’s Eid Special | Inzy Bhai Unboxing ‘Biryani’,2018-06-15,4888896,154386,0,11156,Jun
181,TSP's A Day Before Exam Results,2018-06-12,5419546,162452,0,16026,Jun
182,TSP's Ganju | Sanju Trailer Spoof,2018-06-02,9340956,362027,0,9818,Jun
183,TSP's If Directors Were Teachers,2018-05-16,4861308,161594,0,5057,May
184,"TSP's Bade Chote| Ep 09 : Admission in JNU, IIT, DU & Ameerty",2018-05-09,6934218,196052,0,7782,May
185,The Guy She Tells You Not To Worry About | The Screen Patti,2018-04-30,3391945,98166,0,2764,Apr
186,When You Can't Speak in English | The Screen Patti,2018-04-27,8216903,264709,0,8528,Apr
187,A Day Before Appraisal || The Screen Patti,2018-04-16,4088913,99892,0,3274,Apr
188,Bro Code in School | Exam Special | The Screen Patti,2018-04-12,5087665,148856,0,2787,Apr
189,"Gandi Baat with Jizzy-Veerji ft. Richa Chadda, Rahul Bhat and Sudhir Mishra  |  The Screen Patti",2018-04-06,1208186,33782,0,1203,Apr
190,TSP's If Politicians played Indoor Games,2018-04-03,3943651,146358,0,7618,Apr
191,Commerce Student Ki Kahani || TSP's Baap Ki Adalat,2018-03-30,2548961,86613,0,4277,Mar
192,TSP's Rabish Ki Report | Ep 05 : UPSC Ki Taiyari,2018-03-27,12877798,381366,0,18972,Mar
193,If Superstitions were Real | The Screen Patti,2018-03-18,6319461,193241,0,5465,Mar
194,TSP’s If Employees Behave like Autowalas,2018-03-12,3170113,86229,0,1939,Mar
195,Bro Code with Girls | The Screen Patti,2018-03-07,7063829,242346,0,5152,Mar
196,Board Exams Ki Taiyari | TSP's Rabish Ki Report E04,2018-03-03,6021735,200326,0,8167,Mar
197,TSP's Bade Chote| Ep 06 : सावधान इंडिया  Spoof - एक तरफा प्यार,2018-02-16,12794264,397399,0,16421,Feb
198,TVF Play |  TSP's Zeroes S01E01 | Watch all episodes on www.tvfplay.com,2018-02-02,2098956,56739,0,2920,Feb
199,Bro Code | The Screen Patti 1 Million Special,2018-01-23,10035237,318068,0,4255,Jan
200,Zeroes | Official Trailer | The Screen Patti's New Web-series,2018-01-19,1416776,31901,0,2683,Jan
201,TSP's If Politicians Were Call Centre Employees,2017-12-29,7498721,243374,0,9696,Dec
202,TSP's First Date || Expectations vs Reality,2017-12-22,1321033,34744,0,1125,Dec
203,TSP's Harry Potter meets Engineers || Jizzy-Veerji Recap Show E02,2017-12-19,3734286,85147,0,3042,Dec
204,TSP Singles | Every Long Distance Relationship Ever,2017-12-15,1887296,71341,0,6355,Dec
205,TSP's Rabish Ki Report || E03 - Breakup Se Kaise Ubhrein?,2017-12-10,7486839,243591,0,11577,Dec
206,TSP's Jizzy-Veerji Recap Show | Official Trailer,2017-12-08,404360,11717,0,588,Dec
207,TSP's Naam Mein Kya Rakha Hai,2017-12-05,2132565,46942,0,2000,Dec
208,"TSP’s If Politicians Were Doctors ft. Modi, Adityanath, Kejriwal, Tharoor and Siddhu",2017-12-02,5865879,199198,0,8370,Dec
209,TSP's Bonnet Pe Charcha ft Harsh Beniwal | E03 - Gym vs Yoga,2017-11-22,1687978,47881,0,1983,Nov
210,TSP's Kyun Bane Crorepati ft. Sanjay Mishra | KBC Spoof,2017-11-18,7133767,195088,0,4890,Nov
211,TSP's Bonnet Pe Charcha ft. Harsh Beniwal | E02 - Solo Trip vs Group Trip,2017-11-14,1601619,38925,0,1031,Nov
212,TSP's Bonnet Pe Charcha ft. Harsh Beniwal | E01 - Football vs Cricket,2017-11-08,2123158,59575,0,5311,Nov
213,TSP Singles || Why People Quit Jobs,2017-11-01,4033735,103560,0,3056,Nov
214,Engineering Vs Medical Students | TSP Fukrapanti,2017-10-27,2641335,80885,0,3218,Oct
215,TSP Fukrapanti | If Politicians Were Shopkeepers || Diwali Special,2017-10-18,4455840,143293,0,6173,Oct
216,TSP's Bade Chote | Ep 05 : KBC Spoof,2017-10-11,17139067,424172,0,12148,Oct
217,TSP's Rabish Ki Report | Ep 02 : Rabish Chala Disco,2017-10-06,5058416,202916,0,15118,Oct
218,TSP Singles || When You Visit Home After Ages,2017-09-27,4673752,122527,0,2272,Sep
219,TSP Singles || Things People Forget,2017-09-19,4627238,119388,0,1775,Sep
220,TSP's Bade Chote || Ep 04 : Khatron Ke Khiladi Spoof,2017-09-16,17528022,477254,0,12740,Sep
221,Thanks for 500k Subscribers!,2017-09-13,89676,2254,0,375,Sep
222,Hrithik's Reply To Kangana || TSP's Baap Ki Adalat Ep 3,2017-09-12,3571269,92279,0,3365,Sep
223,TSP's Rabish Ki Report UNCENSORED || Ep 01 : Laundo Ki House Party,2017-09-09,6816327,186361,0,8093,Sep
224,"TSP Fukrapanti | If Politicians Were Teachers | ft. Modi, Kejriwal, Tharoor, Swaraj",2017-09-04,7932742,290743,0,7675,Sep
225,TSP Singles || Things Which Spoil Your Mood,2017-08-23,3370304,87735,0,1039,Aug
226,TSP's East India Consultancy || India vs Pakistan - Part 02 || Independence Day Special,2017-08-14,1335894,34202,0,2077,Aug
227,TSP's East India Consultancy || India vs Pakistan - Part 01 || Independence Day Special,2017-08-14,2746483,53354,0,1046,Aug
228,TSP Singles || Things People Say When You Fall Sick,2017-08-08,1953638,50920,0,748,Aug
229,TSP Fukrapanti | Serial Eater,2017-08-02,1858523,62907,0,1859,Aug
230,Men Will Be Men || TSP Singles,2017-07-17,5204062,135852,0,1604,Jul
231,Result Sharmaji Ke Bete Ka || TSP's Baap ki Adalat,2017-07-11,3865037,83811,0,2757,Jul
232,TSP's Bade Chote || Ep 02 : Dhinchak Pooja Indian Idol Audition,2017-07-05,20208815,388162,0,11170,Jul
233,TSP || Jizzy-Veerji and Friends || GST Explained by Bollywood,2017-07-04,588560,13638,0,517,Jul
234,TSP Singles || EID Special,2017-06-25,1391024,54458,0,1280,Jun
235,TVFPlay | Office vs Office S01E01 | Watch all episodes on www.tvfplay.com,2017-06-23,892237,6190,0,465,Jun
236,TSP's Office vs Office || Web Series Official Trailer,2017-06-19,211037,2510,0,186,Jun
237,TSP || Jizzy-Veerji and Friends E03 || Champions Trophy 2017 Final Special,2017-06-16,1638660,26958,0,5453,Jun
238,TSP || Jizzy-Veerji and Friends E02 || INDvSA Champions Trophy 2017 Special,2017-06-11,560523,6957,0,563,Jun
239,TSP || Jizzy-Veerji and Friends E01 || INDvPAK Champions Trophy 2017 Special,2017-06-02,1468172,24733,0,1915,Jun
240,TSP Fukrapanti | 13 Reasons Why You Are Still Single,2017-05-31,2772237,81568,0,1578,May
241,TSP Singles || Every Sachin Fan,2017-05-27,832911,21338,0,1047,May
242,TSP || Bollywood Cricket Commentary Ep 04 || Naiyo Naiyo IPL Special,2017-05-20,305804,6990,0,222,May
243,TSP Bade Chote || Ep 01 : Bahubali vs Game Of Thrones,2017-05-17,3824123,116782,0,4602,May
244,TSP || Bollywood Cricket Commentary Ep 03 || Jeene Ke Hain Chaar Din,2017-05-13,303451,7990,0,267,May
245,TSP Singles || Types of People in a 9 to 5 Job,2017-04-24,2143068,49414,0,852,Apr
246,TSP || Desi BC | Jobless Engineers vs. HR,2017-04-19,6166840,130371,0,2600,Apr
247,TSP Fukrapanti | Test Match vs. T20,2017-03-29,981527,25244,0,740,Mar
248,TSP || Jizzy Veerji and Friends,2017-03-12,116619,2779,0,58,Mar
249,TSP Fukrapanti | Unwanted Touches,2017-02-23,1510024,38005,0,379,Feb
250,TSP || Jizzy-Veerji and friends ft. Shahid Kapoor,2017-02-21,501063,10306,0,100,Feb
251,TSP Singles || High at a Shaadi,2017-02-18,1781829,33647,0,561,Feb
252,TSP Singles || When You Ask For Directions,2017-01-20,433950,13057,0,230,Jan
253,TSP || First vs Last Week of The Month,2017-01-11,2308383,66508,0,732,Jan
254,TSP Singles || Every Dhoni Fan,2017-01-06,2418073,144772,0,7020,Jan
255,TSP Fukrapanti | Types of Golgappa Eaters,2016-11-15,3012253,82764,0,1565,Nov
256,TSP || Hotline Bling Parody #Fakeoff #SpriteComedyKonkout,2016-07-28,230370,5154,0,222,Jul
257,"CUTE VOL. 1 Feat. Raftaar, Kanan GIll  (Music Video Cut)",2016-06-28,3921910,81552,0,1722,Jun
258,TSP Singles || Every Joint Family Ever,2016-05-20,2153550,38230,0,621,May
259,SHOCKING!! HRITHIK KANGANA LEAKED PHONE CALL AFTER LEGAL NOTICE,2016-04-21,1367351,17062,0,848,Apr
260,TSP's  Behind The Scenes | Ep02 : Batman vs Superman Desi Version,2016-04-06,55476,684,0,33,Apr
261,Civil War Hindi Trailer || Engineering Version | TSP Fukrapanti DumbSmash Ep. 3,2016-04-02,1274050,28274,0,785,Apr
262,TSP || Batman v Superman Desi Version: Holi Party,2016-03-22,2286904,39136,0,1289,Mar
263,TSP Fukrapanti | Leaked Footage: Sanju Baba Drinking With Bhai After Release,2016-02-25,6428170,153786,0,3807,Feb
264,TSP | Small Talk EP-01 | The Break-Up Sex |,2016-01-20,777459,9058,0,645,Jan
